{
  "$schema": "https://json-schema.org/draft/2020-12/schema",
  "title": "Solver Input Schema",
  "description": "Deterministic configuration for Navier-Stokes solver. No internal defaults permitted.",
  "type": "object",
  "required": [
    "grid",
    "fluid_properties",
    "initial_conditions",
    "simulation_parameters",
    "boundary_conditions",
    "mask",
    "external_forces",
    "domain_configuration"
  ],
  "properties": {
    "domain_configuration": {
      "type": "object",
      "required": [
        "type"
      ],
      "properties": {
        "type": {
          "type": "string",
          "enum": [
            "INTERNAL",
            "EXTERNAL"
          ],
          "description": "INTERNAL: Pressure-driven pipe flow. EXTERNAL: Far-field aerodynamics."
        },
        "reference_velocity": {
          "type": "array",
          "description": "Optional reference velocity of the EXTERNAL flow",
          "minItems": 3,
          "maxItems": 3,
          "items": {
            "type": "number"
          }
        }
      }
    },
    "grid": {
      "type": "object",
      "required": [
        "x_min",
        "x_max",
        "y_min",
        "y_max",
        "z_min",
        "z_max",
        "nx",
        "ny",
        "nz"
      ],
      "properties": {
        "x_min": {
          "type": "number",
          "description": "Physical coordinate of the domain start in X."
        },
        "x_max": {
          "type": "number",
          "description": "Physical coordinate of the domain end in X."
        },
        "y_min": {
          "type": "number",
          "description": "Physical coordinate of the domain start in Y."
        },
        "y_max": {
          "type": "number",
          "description": "Physical coordinate of the domain end in Y."
        },
        "z_min": {
          "type": "number",
          "description": "Physical coordinate of the domain start in Z."
        },
        "z_max": {
          "type": "number",
          "description": "Physical coordinate of the domain end in Z."
        },
        "nx": {
          "type": "integer",
          "minimum": 1,
          "description": "Number of discrete computational cells along the X-axis."
        },
        "ny": {
          "type": "integer",
          "minimum": 1,
          "description": "Number of discrete computational cells along the Y-axis."
        },
        "nz": {
          "type": "integer",
          "minimum": 1,
          "description": "Number of discrete computational cells along the Z-axis."
        }
      }
    },
    "fluid_properties": {
      "type": "object",
      "required": [
        "density",
        "viscosity"
      ],
      "properties": {
        "density": {
          "type": "number",
          "exclusiveMinimum": 0
        },
        "viscosity": {
          "type": "number",
          "minimum": 0
        }
      }
    },
    "initial_conditions": {
      "type": "object",
      "required": [
        "velocity",
        "pressure"
      ],
      "properties": {
        "velocity": {
          "type": "array",
          "minItems": 3,
          "maxItems": 3,
          "items": {
            "type": "number"
          }
        },
        "pressure": {
          "type": "number"
        }
      }
    },
    "simulation_parameters": {
      "type": "object",
      "required": [
        "time_step",
        "total_time",
        "output_interval"
      ],
      "properties": {
        "time_step": {
          "type": "number",
          "exclusiveMinimum": 0
        },
        "total_time": {
          "type": "number",
          "exclusiveMinimum": 0
        },
        "output_interval": {
          "type": "integer",
          "minimum": 1
        }
      }
    },
    "boundary_conditions": {
      "type": "array",
      "items": {
        "type": "object",
        "required": [
          "location",
          "type",
          "values"
        ],
        "properties": {
          "location": {
            "enum": [
              "x_min",
              "x_max",
              "y_min",
              "y_max",
              "z_min",
              "z_max",
              "wall"
            ]
          },
          "type": {
            "enum": [
              "no-slip",
              "free-slip",
              "inflow",
              "outflow",
              "pressure"
            ]
          },
          "values": {
            "type": "object",
            "properties": {
              "u": {
                "type": "number"
              },
              "v": {
                "type": "number"
              },
              "w": {
                "type": "number"
              },
              "p": {
                "type": "number"
              }
            },
            "additionalProperties": false,
            "minProperties": 1
          }
        }
      }
    },
    "mask": {
      "type": "array",
      "description": "Canonical flattening: i + nx*(j + ny*k). Must match grid.nx*grid.ny*grid.nz length.",
      "items": {
        "type": "integer",
        "enum": [
          -1,
          0,
          1
        ]
      }
    },
    "external_forces": {
      "type": "object",
      "required": [
        "force_vector"
      ],
      "properties": {
        "force_vector": {
          "type": "array",
          "minItems": 3,
          "maxItems": 3,
          "items": {
            "type": "number"
          }
        }
      }
    }
  }
}