{"domain_configuration": {"type": "INTERNAL"}, "grid": {"x_min": 0.0, "x_max": 1.0, "y_min": 0.0, "y_max": 1.0, "z_min": 0.0, "z_max": 1.0, "nx": 4, "ny": 4, "nz": 4}, "fluid_properties": {"density": 1.0, "viscosity": 0.001}, "initial_conditions": {"velocity": [0.0, 0.0, 0.0], "pressure": 1.0}, "simulation_parameters": {"time_step": 0.1, "total_time": 0.2, "output_interval": 1}, "boundary_conditions": [{"location": "x_min", "type": "inflow", "values": {"u": 1.0, "v": 0.0, "w": 0.0}}, {"location": "x_max", "type": "outflow", "values": {"p": 0.0}}], "mask": [0, 0, 0, 0, 0, 0, 0, 0, 0, 0, 0, 0, 0, 0, 0, 0, 0, 0, 0, 0, 0, 0, 0, 0, 0, 0, 0, 0, 0, 0, 0, 0, 0, 0, 0, 0, 0, 0, 0, 0, 0, 0, 0, 0, 0, 0, 0, 0, 0, 0, 0, 0, 0, 0, 0, 0, 0, 0, 0, 0, 0, 0, 0, 0], "external_forces": {"force_vector": [0.0, -9.81, 0.0]}}